{
  "_meta": {
    "version": "1.0",
    "generated": "2026-03-10T14:30:00Z",
    "format": "agent-persona-profile",
    "description": "Structured personal profile for AI agent consumption.",
    "privacy": {
      "identity": "public",
      "career": "public",
      "vehicles": "agent-only",
      "health": "agent-only",
      "food": "public",
      "home": "agent-only",
      "finance": "private",
      "hobbies": "public",
      "personality": "public",
      "aspirations": "public"
    }
  },
  "identity": {
    "name": "Alex Chen",
    "preferred_name": "Alex",
    "age": 31,
    "location_city": "Austin",
    "location_state": "TX",
    "location_country": "US",
    "timezone": "US/Central",
    "languages": ["English", "Mandarin"],
    "pronouns": "he/him",
    "bio": "Backend engineer who builds cars on weekends and overthinks coffee."
  },
  "career": {
    "job_title": "Senior Software Engineer",
    "company": "Stripe",
    "industry": "FinTech",
    "years_experience": 8,
    "hard_skills": ["Go", "Python", "PostgreSQL", "Kubernetes", "gRPC", "Terraform", "Redis"],
    "soft_skills": ["Technical writing", "Mentoring", "System design"],
    "tools": ["Neovim", "iTerm2", "Linear", "Slack", "Notion", "DataDog"],
    "work_style": "Deep focus / solo",
    "work_schedule": "10am-6pm, flexible",
    "career_aspiration": "Staff engineer track, eventually want to start a dev tools company",
    "past_roles": "Backend eng at Shopify (2019-2022), full-stack at a YC startup (2018-2019)",
    "education": "BS Computer Science, UT Austin",
    "certifications": "AWS Solutions Architect Associate"
  },
  "vehicles": {
    "vehicle_1_year": 2022,
    "vehicle_1_make": "Toyota",
    "vehicle_1_model": "GR86",
    "vehicle_1_trim": "Premium, 2.4L flat-4",
    "vehicle_1_mileage": 28500,
    "vehicle_1_weekly_miles": 120,
    "vehicle_1_fuel": "Premium Gas",
    "vehicle_1_last_oil_change": "Feb 2026 / 27,000 mi",
    "vehicle_1_last_tire_rotation": "Jan 2026 / 26,200 mi",
    "vehicle_2_year": 2019,
    "vehicle_2_make": "Honda",
    "vehicle_2_model": "CR-V",
    "vehicle_2_mileage": 61000,
    "vehicle_2_weekly_miles": 40,
    "vehicle_2_fuel": "Regular Gas",
    "commute_method": "Remote / WFH",
    "commute_distance": 0
  },
  "health": {
    "height": "5'11\"",
    "weight": "175 lbs",
    "blood_type": "O+",
    "allergies": "Seasonal (cedar, ragweed)",
    "medications": ["Vitamin D", "Magnesium", "Zyrtec (seasonal)"],
    "conditions": "Mild lower back pain from sitting",
    "exercise_frequency": "4-6x/week",
    "exercise_types": ["Weightlifting", "Running", "Bouldering"],
    "fitness_goals": "Hit a 315 lb squat, run a sub-25 min 5K",
    "sleep_hours": 7,
    "sleep_schedule": "11:30pm - 6:30am",
    "steps_daily": 9500,
    "wearable_device": "Apple Watch Ultra 2"
  },
  "food": {
    "diet_type": "No restrictions",
    "food_allergies": "None",
    "favorite_cuisines": ["Japanese", "Korean", "Mexican", "Szechuan"],
    "favorite_foods": "Tonkotsu ramen, birria tacos, mapo tofu, smash burgers",
    "disliked_foods": "Blue cheese, raw oysters, licorice",
    "cooking_skill": "Intermediate",
    "cooking_frequency": "A few times a week",
    "meals_per_day": "3",
    "coffee_tea": "Pour-over black coffee in the AM, matcha in the afternoon",
    "alcohol": "Craft IPAs, Japanese whisky occasionally",
    "grocery_budget_weekly": 130,
    "meal_prep": "Sometimes"
  },
  "home": {
    "home_type": "Apartment",
    "own_or_rent": "Rent",
    "home_size": "950 sqft / 2BR",
    "household_members": "Girlfriend",
    "pets": "Orange tabby cat, 3 yrs, named Byte",
    "smart_home": "Hue lights, HomePod Mini, Ecobee thermostat",
    "home_projects": "Building a standing desk, setting up a homelab",
    "cleaning_frequency": "Weekly",
    "yard_garden": "Balcony / patio",
    "climate": "Hot & humid"
  },
  "finance": {
    "income_range": "$150k-$250k",
    "financial_goals": "Max out 401k + Roth IRA, save for a house down payment by 2028",
    "monthly_savings_target": 2500,
    "investment_experience": "Intermediate",
    "investment_accounts": "401k, Roth IRA, Fidelity brokerage, small crypto position",
    "debt_types": "None — paid off student loans in 2024",
    "budget_method": "App (YNAB, Mint, etc.)",
    "insurance_types": "Health (through employer), renter's, auto, umbrella",
    "side_income": "Occasional freelance consulting, open source sponsorship",
    "financial_stress_level": 2
  },
  "hobbies": {
    "hobbies": ["Cars / autocross", "Mechanical keyboards", "Bouldering", "Gaming", "Cooking", "Open source"],
    "favorite_games": "Elden Ring, Hades II, Factorio, chess (1400 Elo)",
    "music_genres": ["Lo-fi hip hop", "Indie rock", "Japanese city pop", "Synthwave"],
    "favorite_artists": "Khruangbin, Tatsuro Yamashita, Tycho, Nujabes",
    "tv_movies": "Severance, The Bear, Interstellar, Everything Everywhere All at Once",
    "books_reading": "Currently reading 'Designing Data-Intensive Applications', enjoy sci-fi (Ted Chiang, Liu Cixin)",
    "sports_follow": "F1 (McLaren), NBA (Mavs)",
    "sports_play": "Basketball pickup games, bouldering",
    "travel_style": "Mid-range comfort",
    "dream_destinations": "Japan (again), New Zealand, Norway, Taiwan",
    "collections": "Mechanical keyboard keycap sets",
    "communities": ["r/MechanicalKeyboards", "Austin Cars & Coffee", "Local bouldering gym crew"]
  },
  "personality": {
    "mbti": "INTJ",
    "enneagram": "5w6",
    "communication_style": "Direct and blunt",
    "humor_style": "Dry / deadpan",
    "learning_style": "Reading / text",
    "decision_making": "Research everything first",
    "morning_or_night": "Night owl",
    "introvert_extrovert": "Slight introvert",
    "values": "Craft, autonomy, honesty, continuous improvement",
    "pet_peeves": "Meetings that could be async, vague requirements, people who don't read the docs",
    "agent_tone": "Nerdy / technical",
    "agent_verbosity": "TL;DR then I'll ask for more"
  },
  "aspirations": {
    "life_goals": "Start a dev tools company, build a track car from scratch, achieve financial independence by 45",
    "learning_now": "Rust, distributed systems, basic welding",
    "want_to_learn": "Electronics / embedded systems, Japanese language",
    "challenges": "Balancing deep work time with relationship, avoiding burnout",
    "proudest_achievement": "Built an open source tool that hit 10k GitHub stars",
    "biggest_fear": "Getting comfortable and stopping growth",
    "ideal_day": "Wake up 7am, pour-over coffee, 4 hours of deep coding, gym at lunch, afternoon learning/reading, cook dinner with girlfriend, evening gaming or tinkering",
    "causes": "Open source sustainability, STEM education access"
  }
}
