{
  "_meta": {
    "version": "1.0",
    "generated": "2026-03-10T14:30:00Z",
    "format": "agent-persona-profile",
    "privacy": {
      "identity": "public",
      "career": "public",
      "vehicles": "agent-only",
      "health": "private",
      "finance": "private"
    }
  },
  "identity": {
    "name": "James Mitchell",
    "preferred_name": "James",
    "age": 39,
    "location_city": "Charlotte",
    "location_state": "NC",
    "location_country": "US",
    "timezone": "US/Eastern",
    "languages": ["English"],
    "pronouns": "he/him",
    "bio": "Project manager, dad of two, amateur woodworker, professional snack fetcher."
  },
  "career": {
    "job_title": "Senior Project Manager",
    "company": "Bank of America",
    "industry": "Banking / Finance",
    "years_experience": 14,
    "hard_skills": ["Program management", "Jira", "Confluence", "Excel", "SQL (basic)", "Budgeting"],
    "soft_skills": ["Stakeholder management", "Conflict resolution", "Team building", "Presentations"],
    "tools": ["Jira", "Confluence", "Slack", "Teams", "Excel", "PowerPoint", "Miro"],
    "work_style": "Meetings-heavy",
    "work_schedule": "8am-5pm, strict — kids' pickup at 5:30",
    "career_aspiration": "Director level in 2-3 years, possibly VP track, open to switching to tech company",
    "past_roles": "PM at Wells Fargo (2016-2020), business analyst at Deloitte (2012-2016)",
    "education": "BS Business Administration, UNC Chapel Hill; MBA, Wake Forest",
    "certifications": "PMP, Certified Scrum Master"
  },
  "vehicles": {
    "vehicle_1_year": 2023,
    "vehicle_1_make": "Toyota",
    "vehicle_1_model": "Highlander",
    "vehicle_1_trim": "XLE, Hybrid",
    "vehicle_1_mileage": 22000,
    "vehicle_1_weekly_miles": 200,
    "vehicle_1_fuel": "Hybrid",
    "vehicle_1_last_oil_change": "Jan 2026 / 20,000 mi",
    "vehicle_1_last_tire_rotation": "Nov 2025 / 18,500 mi",
    "vehicle_2_year": 2018,
    "vehicle_2_make": "Ford",
    "vehicle_2_model": "F-150",
    "vehicle_2_mileage": 87000,
    "vehicle_2_weekly_miles": 30,
    "vehicle_2_fuel": "Regular Gas",
    "commute_method": "Drive alone",
    "commute_distance": 18
  },
  "health": {
    "height": "6'1\"",
    "weight": "210 lbs",
    "blood_type": "A+",
    "allergies": "None",
    "medications": ["Lisinopril (blood pressure)", "Fish oil", "Multivitamin"],
    "conditions": "Mild hypertension (managed), occasional lower back pain",
    "exercise_frequency": "2-3x/week",
    "exercise_types": ["Running", "Peloton cycling", "Yard work (counts, right?)"],
    "fitness_goals": "Lose 20 lbs, get back to running a 10K, lower blood pressure naturally",
    "sleep_hours": 6.5,
    "sleep_schedule": "11pm - 5:30am",
    "steps_daily": 6500,
    "wearable_device": "Fitbit Charge 6"
  },
  "food": {
    "diet_type": "No restrictions",
    "food_allergies": "None",
    "favorite_cuisines": ["BBQ", "Southern", "Italian", "Tex-Mex"],
    "favorite_foods": "Smoked brisket, chicken parm, street tacos, loaded baked potatoes",
    "disliked_foods": "Sushi (texture thing), beets, anything too spicy",
    "cooking_skill": "Intermediate",
    "cooking_frequency": "Weekends only",
    "meals_per_day": "3",
    "coffee_tea": "Drip coffee with cream, 2-3 cups before noon",
    "alcohol": "Bourbon, craft beer on weekends, not during the week",
    "grocery_budget_weekly": 250,
    "meal_prep": "No but I want to"
  },
  "home": {
    "home_type": "House",
    "own_or_rent": "Own",
    "home_size": "2800 sqft / 4BR",
    "household_members": "Wife (Sarah, 37), two kids (Emma 7, Liam 4), dog",
    "pets": "Golden Retriever, 5 yrs, named Duke",
    "smart_home": "Ring doorbell, Nest thermostat, Alexa in every room (kids' fault)",
    "home_projects": "Building a deck, need to repaint the garage, want to set up a workshop in the basement",
    "cleaning_frequency": "Bi-weekly",
    "yard_garden": "Yes, big yard",
    "climate": "Mild / temperate"
  },
  "finance": {
    "income_range": "$100k-$150k",
    "financial_goals": "Pay off remaining mortgage faster, fully fund kids' 529 plans, build up emergency fund to 6 months",
    "monthly_savings_target": 1200,
    "investment_experience": "Intermediate",
    "investment_accounts": "401k, Roth IRA, 529 plans (x2), small brokerage",
    "debt_types": "Mortgage, one car payment (Highlander)",
    "budget_method": "Spreadsheet",
    "insurance_types": "Health, dental, vision, auto, homeowner's, life, umbrella",
    "side_income": "Occasional woodworking commissions (cutting boards, small furniture)",
    "financial_stress_level": 4
  },
  "hobbies": {
    "hobbies": ["Woodworking", "Grilling / smoking meat", "Fantasy football", "Coaching kids' soccer", "DIY home projects"],
    "favorite_games": "Madden, Mario Kart (with kids), poker night with buddies",
    "music_genres": ["Classic rock", "Country", "90s hip hop"],
    "favorite_artists": "Tom Petty, Zach Bryan, OutKast, Chris Stapleton",
    "tv_movies": "Yellowstone, Top Gun: Maverick, The Office (rewatching forever), Reacher",
    "books_reading": "Reads mostly on Audible during commute — business books, thrillers (Lee Child, Michael Connelly)",
    "sports_follow": "NFL (Panthers), College football (UNC), NBA (Hornets, loosely)",
    "sports_play": "Golf (18 handicap), coaches U-8 soccer",
    "travel_style": "Road trips",
    "dream_destinations": "Montana ranch trip, Italy with the wife, Disney World again for the kids",
    "collections": "Nothing specific, accumulating too many power tools",
    "communities": ["Church small group", "Neighborhood HOA board (reluctantly)", "Local woodworking club"]
  },
  "personality": {
    "mbti": "ESTJ",
    "enneagram": "Type 3",
    "communication_style": "Friendly but clear",
    "humor_style": "Punny / dad jokes",
    "learning_style": "Video / visual",
    "decision_making": "Pro/con lists",
    "morning_or_night": "Early bird",
    "introvert_extrovert": "Slight extrovert",
    "values": "Family, reliability, hard work, community, faith",
    "pet_peeves": "People who don't follow through, unnecessary meetings (ironic, I know), leaving lights on",
    "agent_tone": "Friendly and casual",
    "agent_verbosity": "Keep it short"
  },
  "aspirations": {
    "life_goals": "Be a great dad, make director by 42, build a woodworking workshop, take the family to Europe",
    "learning_now": "Advanced woodworking joints, basic home electrical (to finish the basement)",
    "want_to_learn": "Investing strategy beyond index funds, Spanish (wife's been pushing this)",
    "challenges": "Never enough time, balancing work ambition with being present for kids, health/weight",
    "proudest_achievement": "Built a treehouse for my kids completely from scratch",
    "biggest_fear": "Missing my kids growing up because I was too focused on work",
    "ideal_day": "Sleep in to 7, big breakfast with the family, morning in the workshop, afternoon at the park with kids, grill dinner, movie night, kids in bed by 8, bourbon on the porch",
    "causes": "Youth sports programs, veterans' support, local community development"
  }
}
